<!--

    ***************************************************************************
    Copyright (c) 2010 Qcadoo Limited
    Project: Qcadoo Framework
    Version: 1.4

    This file is part of Qcadoo.

    Qcadoo is free software; you can redistribute it and/or modify
    it under the terms of the GNU Affero General Public License as published
    by the Free Software Foundation; either version 3 of the License,
    or (at your option) any later version.

    This program is distributed in the hope that it will be useful,
    but WITHOUT ANY WARRANTY; without even the implied warranty
    of MERCHANTABILITY or FITNESS FOR A PARTICULAR PURPOSE.
    See the GNU Affero General Public License for more details.

    You should have received a copy of the GNU Affero General Public License
    along with this program; if not, write to the Free Software
    Foundation, Inc., 51 Franklin St, Fifth Floor, Boston, MA  02110-1301  USA
    ***************************************************************************

-->
<view xmlns:xsi="http://www.w3.org/2001/XMLSchema-instance" xmlns="http://schema.qcadoo.org/view"
	  xsi:schemaLocation="http://schema.qcadoo.org/view http://schema.qcadoo.org/view.xsd" name="groupsList"
	  modelPlugin="qcadooSecurity" modelName="group" menuAccessible="true" defaultAuthorizationRole="ROLE_GROUPS_VIEW">

	<component type="window" name="window">

		<ribbon>
			<group template="gridNewCopyAndRemoveAction" defaultAuthorizationRole="ROLE_GROUPS_EDIT"/>
			<group name="actions">
				<bigButton name="refresh" icon="updateIcon24.png" state="enabled" action="#{grid}.performRefresh;" accesskey="r" />
			</group>
			<group template="gridGenericExportAction"/>
		</ribbon>

		<component type="grid" name="groups" reference="grid">
			<option type="column" name="name" fields="name" link="true"/>
			<option type="column" name="identifier" fields="identifier" link="true"/>
			<option type="column" name="description" fields="identifier,description"
					expression="(#description == null) ? ((#identifier == null) ? '' : '@qcadooSecurity.group.' + #identifier + '.description') : #description"/>
			<option type="column" name="permissionType" fields="permissionType"/>

			<option type="order" column="name" direction="asc"/>

			<option type="orderable" value="name,identifier,permissionType"/>
			<option type="searchable" value="name,identifier,permissionType"/>

			<option type="correspondingView" value="qcadooUsers/groupDetails"/>
			<option type="correspondingComponent" value="form"/>

			<option type="fullscreen" value="true"/>
			<option type="multiselect" value="true"/>
		</component>

		<option type="fixedHeight" value="true"/>
		<option type="header" value="false"/>
	</component>

</view>