<?xml version="1.0" encoding="UTF-8"?>
<!--

    ***************************************************************************
    Copyright (c) 2010 Qcadoo Limited
    Project: Qcadoo Framework
    Version: 1.4

    This file is part of Qcadoo.

    Qcadoo is free software; you can redistribute it and/or modify
    it under the terms of the GNU Affero General Public License as published
    by the Free Software Foundation; either version 3 of the License,
    or (at your option) any later version.

    This program is distributed in the hope that it will be useful,
    but WITHOUT ANY WARRANTY; without even the implied warranty
    of MERCHANTABILITY or FITNESS FOR A PARTICULAR PURPOSE.
    See the GNU Affero General Public License for more details.

    You should have received a copy of the GNU Affero General Public License
    along with this program; if not, write to the Free Software
    Foundation, Inc., 51 Franklin St, Fifth Floor, Boston, MA  02110-1301  USA
    ***************************************************************************

-->
<view xmlns:xsi="http://www.w3.org/2001/XMLSchema-instance" xmlns="http://schema.qcadoo.org/view"
	  xsi:schemaLocation="http://schema.qcadoo.org/view http://schema.qcadoo.org/view.xsd" name="dictionariesList"
	  modelPlugin="qcadooModel" modelName="dictionary" menuAccessible="true"
	  defaultAuthorizationRole="ROLE_DICTIONARY_VIEW">

	<component type="window" name="window">

		<ribbon>
		</ribbon>

		<component type="grid" name="dictionaries" reference="grid">
			<option type="column" name="label" fields="name" link="true"/>
			<option type="order" column="label" direction="asc"/>
			<option type="paginable" value="true"/>
			<option type="correspondingView" value="qcadooDictionaries/dictionaryDetails"/>
			<option type="correspondingComponent" value="form"/>
			<option type="deletable" value="false"/>
			<option type="creatable" value="false"/>
			<option type="fullscreen" value="true"/>
		</component>

		<option type="fixedHeight" value="true"/>
		<option type="header" value="false"/>
	</component>

	<hooks>
		<beforeRender class="com.qcadoo.plugins.dictionaries.internal.ViewDictionaryService"
					  method="addRestrictionToDictionariesGrid"/>
		<beforeRender class="com.qcadoo.plugins.dictionaries.internal.ViewDictionaryService" method="translateLabel"/>
	</hooks>

</view>