<!--

    ***************************************************************************
    Copyright (c) 2010 Qcadoo Limited
    Project: Qcadoo Framework
    Version: 1.4

    This file is part of Qcadoo.

    Qcadoo is free software; you can redistribute it and/or modify
    it under the terms of the GNU Affero General Public License as published
    by the Free Software Foundation; either version 3 of the License,
    or (at your option) any later version.

    This program is distributed in the hope that it will be useful,
    but WITHOUT ANY WARRANTY; without even the implied warranty
    of MERCHANTABILITY or FITNESS FOR A PARTICULAR PURPOSE.
    See the GNU Affero General Public License for more details.

    You should have received a copy of the GNU Affero General Public License
    along with this program; if not, write to the Free Software
    Foundation, Inc., 51 Franklin St, Fifth Floor, Boston, MA  02110-1301  USA
    ***************************************************************************

-->
<view xmlns:xsi="http://www.w3.org/2001/XMLSchema-instance" xmlns="http://schema.qcadoo.org/view"
	  xsi:schemaLocation="http://schema.qcadoo.org/view http://schema.qcadoo.org/view.xsd" name="rolesList"
	  modelPlugin="qcadooSecurity" modelName="role" menuAccessible="true" defaultAuthorizationRole="ROLE_SUPERADMIN">

	<component type="window" name="window">

		<ribbon>
			<template name="standardGridTemplate" excludeItems="actions.copy, actions.delete, actions.new"/>
		</ribbon>

		<component type="grid" name="roles" reference="grid">
			<option type="column" name="identifier" fields="identifier" link="true"/>
			<option type="column" name="description" fields="identifier,description"
					expression="(#description == null) ? '@qcadooSecurity.role.' + #identifier + '.description' : #description"/>

			<option type="order" column="identifier" direction="asc"/>

			<option type="orderable" value="identifier"/>
			<option type="searchable" value="identifier"/>

			<option type="correspondingView" value="qcadooUsers/roleDetails"/>
			<option type="correspondingComponent" value="form"/>

			<option type="fullscreen" value="true"/>
			<option type="multiselect" value="true"/>
		</component>

		<option type="fixedHeight" value="true"/>
		<option type="header" value="false"/>
	</component>

</view>